[
	{
		"id": "implemented-an-integrated-cloud-ecommerce-solution-for-1-200-businesses",
		"status": "current",
		"text": "Implemented an integrated cloud eCommerce solution for 1,200+ businesses containing website, app, POS software, CRM, CMS, accounting software, ticketing, and form builder.",
		"annotations": []
	},
	{
		"id": "launched-an-automated-app-factory-that-generated-a-native-android-shoppi",
		"status": "current",
		"text": "Launched an automated app factory that generated a native android shopping app without coding in less than 10 minutes.",
		"annotations": []
	}
]
