[
	{
		"id": "led-development-of-a-booking-platform-with-10-distinct-designs-and-drov",
		"status": "current",
		"text": "Led development of a booking platform with 10+ distinct designs and drove OKRs to establish a new revenue stream.",
		"annotations": []
	},
	{
		"id": "automated-deployment-process-with-ci-cd-cut-time-from-months-to-less-th",
		"status": "alternate",
		"text": "Automated deployment process with CI/CD, cut time from months to less than 10 minutes and ensured zero downtime.",
		"annotations": []
	},
	{
		"id": "refactored-e2e-tests-and-designed-35-cypress-tests-enhanced-pipeline-e",
		"status": "alternate",
		"text": "Refactored E2E tests and designed 35+ Cypress tests, enhanced pipeline efficiency, performance and reliability.",
		"annotations": []
	},
	{
		"id": "architected-a-pixel-perfect-ui-with-atomic-design-utilized-storybook-wi",
		"status": "current",
		"text": "Architected a pixel-perfect UI with Atomic Design, utilized Storybook with 1,000+ tests for high quality and scalability.",
		"annotations": []
	}
]
